{
  "schema_version": "2.0.0",
  "identity": {
    "slug": "materiais-cirurgicos",
    "id": null,
    "state": "decision_required"
  },
  "title": "Materiais Cirúrgicos",
  "subtitle": "Instrumentais, campos, acessórios e materiais utilizados em procedimentos cirúrgicos.",
  "template_family": "device-library",
  "archetype_id": "material_library",
  "domain": {
    "domain_id": "materials-devices",
    "display_label": "Materiais e Dispositivos"
  },
  "locale": "pt-BR",
  "jurisdiction": {
    "state": "decision_required",
    "value": null
  },
  "governance": {
    "lifecycle_status": "template_evaluation",
    "review_status": "not_reviewed",
    "evidence_verification_status": "not_verified",
    "approved_by": null,
    "last_reviewed": null
  },
  "badges": [
    {
      "label": "Uso único"
    },
    {
      "label": "Reutilizável"
    }
  ],
  "breadcrumbs": [
    "Início",
    "Materiais e Dispositivos",
    "Biblioteca de Materiais Cirúrgicos"
  ],
  "navigation": {
    "active_tab_id": "visao-geral",
    "tabs": [
      {
        "tab_id": "visao-geral",
        "label": "Visão Geral",
        "status": "mapped",
        "module_refs": [
          "overview",
          "primary-categories",
          "featured-instruments",
          "consumables",
          "sterilization-and-care",
          "contraindications-and-alerts",
          "videos-and-techniques",
          "articles-and-evidence",
          "compatibilities",
          "norms-and-regulations",
          "verification-checklist",
          "support-materials",
          "page-actions"
        ],
        "selectors": []
      },
      {
        "tab_id": "instrumentais",
        "label": "Instrumentais",
        "status": "mapped",
        "module_refs": [
          "featured-instruments"
        ],
        "selectors": []
      },
      {
        "tab_id": "campos-e-compressas",
        "label": "Campos e Compressas",
        "status": "mapped",
        "module_refs": [
          "primary-categories",
          "consumables"
        ],
        "selectors": [
          {
            "module_id": "primary-categories",
            "item_title_contains": [
              "Campos e Compressas"
            ]
          },
          {
            "module_id": "consumables",
            "item_title_contains": [
              "Compressas"
            ]
          }
        ]
      },
      {
        "tab_id": "fios-de-sutura",
        "label": "Fios de Sutura",
        "status": "mapped",
        "module_refs": [
          "primary-categories"
        ],
        "selectors": [
          {
            "module_id": "primary-categories",
            "item_title_contains": [
              "Fios de Sutura"
            ]
          }
        ]
      },
      {
        "tab_id": "acessorios",
        "label": "Acessórios",
        "status": "mapped",
        "module_refs": [
          "primary-categories"
        ],
        "selectors": [
          {
            "module_id": "primary-categories",
            "item_title_contains": [
              "Acessórios"
            ]
          }
        ]
      },
      {
        "tab_id": "equipamentos",
        "label": "Equipamentos",
        "status": "mapped",
        "module_refs": [
          "primary-categories"
        ],
        "selectors": [
          {
            "module_id": "primary-categories",
            "item_title_contains": [
              "Equipamentos"
            ]
          }
        ]
      },
      {
        "tab_id": "esterilizacao",
        "label": "Esterilização",
        "status": "mapped",
        "module_refs": [
          "sterilization-and-care"
        ],
        "selectors": []
      },
      {
        "tab_id": "seguranca",
        "label": "Segurança",
        "status": "mapped",
        "module_refs": [
          "contraindications-and-alerts"
        ],
        "selectors": []
      },
      {
        "tab_id": "materiais",
        "label": "Materiais",
        "status": "mapped",
        "module_refs": [
          "support-materials"
        ],
        "selectors": []
      }
    ],
    "overflow_control": null
  },
  "modules": [
    {
      "module_id": "overview",
      "module_type": "overview",
      "semantic_role": "orientation",
      "title": "Visão Geral",
      "priority": 1,
      "payload": {
        "media": {
          "src": "../assets/materiais-cirurgicos/hero_materiais_cirurgicos_transparent.png",
          "alt": "Fotografia de instrumentais cirúrgicos metálicos organizados sobre campo azul, com compressas ao fundo.",
          "raw": {
            "media_type": "image",
            "description": "Fotografia de instrumentais cirúrgicos metálicos organizados sobre campo azul, com compressas ao fundo.",
            "asset_ref": "DECISION_REQUIRED",
            "provenance": {
              "class": "A",
              "basis": "Observado diretamente na imagem de referência.",
              "external_validation": "not_performed"
            }
          }
        },
        "groups": [
          {
            "id": "primary",
            "title": "Informações gerais",
            "items": [
              {
                "id": "funcao",
                "title": "Função",
                "subtitle": "",
                "description": "Garantir precisão, segurança e eficácia durante os procedimentos cirúrgicos.",
                "image": null,
                "icon": null,
                "badge": null,
                "sequence": null,
                "metric": null,
                "items": [],
                "attributes": {}
              },
              {
                "id": "seguranca",
                "title": "Segurança",
                "subtitle": "",
                "description": "Materiais projetados para desempenho confiável e mínima reação tecidual.",
                "image": null,
                "icon": null,
                "badge": null,
                "sequence": null,
                "metric": null,
                "items": [],
                "attributes": {}
              },
              {
                "id": "qualidade",
                "title": "Qualidade",
                "subtitle": "",
                "description": "Produzidos em aço inoxidável cirúrgico ou materiais de alta performance.",
                "image": null,
                "icon": null,
                "badge": null,
                "sequence": null,
                "metric": null,
                "items": [],
                "attributes": {}
              },
              {
                "id": "esterilizacao",
                "title": "Esterilização",
                "subtitle": "",
                "description": "Devem estar estéreis antes do uso conforme normas vigentes.",
                "image": null,
                "icon": null,
                "badge": null,
                "sequence": null,
                "metric": null,
                "items": [],
                "attributes": {}
              }
            ]
          },
          {
            "id": "secondary",
            "title": "Características importantes",
            "items": [
              {
                "id": "resistencia",
                "title": "Resistência",
                "subtitle": "",
                "description": "Alta resistência à corrosão e ao desgaste.",
                "image": null,
                "icon": null,
                "badge": null,
                "sequence": null,
                "metric": null,
                "items": [],
                "attributes": {}
              },
              {
                "id": "precisao",
                "title": "Precisão",
                "subtitle": "",
                "description": "Acabamento que proporciona maior precisão e controle.",
                "image": null,
                "icon": null,
                "badge": null,
                "sequence": null,
                "metric": null,
                "items": [],
                "attributes": {}
              },
              {
                "id": "ergonomia",
                "title": "Ergonomia",
                "subtitle": "",
                "description": "Design anatômico para manuseio confortável e seguro.",
                "image": null,
                "icon": null,
                "badge": null,
                "sequence": null,
                "metric": null,
                "items": [],
                "attributes": {}
              },
              {
                "id": "rastreabilidade",
                "title": "Rastreabilidade",
                "subtitle": "",
                "description": "Identificação de lote e fabricante para rastreabilidade.",
                "image": null,
                "icon": null,
                "badge": null,
                "sequence": null,
                "metric": null,
                "items": [],
                "attributes": {}
              }
            ]
          }
        ]
      },
      "actions": [],
      "provenance_ref": "../provenance/pages/materiais-cirurgicos.provenance.json#/module_provenance/overview"
    },
    {
      "module_id": "primary-categories",
      "module_type": "card_grid",
      "semantic_role": "classification",
      "title": "Categorias principais",
      "priority": 10,
      "payload": {
        "items": [
          {
            "id": "instrumentais",
            "title": "Instrumentais",
            "subtitle": "",
            "description": "Pinças, tesouras, afastadores, porta-agulhas e outros.",
            "image": "../assets/materiais-cirurgicos/categoria_instrumentais_transparent.png",
            "icon": null,
            "badge": null,
            "sequence": null,
            "metric": 127,
            "items": [],
            "attributes": {},
            "cta": {
              "label": "Ver detalhes",
              "action": "open_detail"
            }
          },
          {
            "id": "campos-e-compressas",